Task_ID,Task_Type,Assigned_Node,Status,Target_Ligand,Batch_File,Start_Time,Completion_Time,Notes
fep_demo_l147r,rbfe,Node-Alpha,DONE,Cortisol,-,2026-06-15,2026-06-15,L147Rxcortisol cycle ddG=-8.6kJ/mol sign-correct; results/stage3_fep/proto_l147r_cortisol/FEP_DEMO_RESULTS.md
fep_e106l_spec,rbfe,Node-Alpha,DONE,multi,-,2026-06-16,2026-06-16,E106L 4-ligand+apo converged but fails vs assay (GIGO 2nd-shell+unstable pose); results/stage3_fep/e106l_specificity/SPECIFICITY_RESULTS.md
gate2lig_testosterone,boltz-2lig-gate,Node-Alpha,DONE,Testosterone,-,2026-06-16,2026-06-16,2-lig gate all 71: 58/71 pass; holo opens wide for ALL (agonist non-discriminating - likely Boltz over-opens) so APO/basal-leak is the real filter; leads des0039/44/60 pass; results/stage3_dring/gate2lig/gate2lig.json
gen_screen_prog,gen+flexddG,Node-Aspartate,REASSIGNED,Progesterone,-,-,-,MOVED from Alpha (queue cancelled 2026-06-16); ligand-aware D-ring+S/T/N/Q(C20) bias keep A-ring; results/stage3_prog/
gen_screen_cort,gen+flexddG,Node-Aspartate,REASSIGNED,Cortisol,-,-,-,MOVED from Alpha (queue cancelled 2026-06-16); R123E anchor+polar D-ring; results/stage3_cort/
gen_screen_estradiol,gen+flexddG,Node-Aspartate,PENDING,Estradiol,-,-,-,re-screen estradiol on aspartate (Glu/Arg/His clamp design); results/stage3_estradiol/
progcort_2lig_gate,boltz-2lig-gate,Node-Aspartate,PENDING,Progesterone/Cortisol,-,-,-,run on screen leads after gen_screen completes
ligand_rbfe_triad,ligand-rbfe,Node-Beta,PENDING,test/prog/cort,-,-,-,DEV build dDDG specificity executor; identical A-ring maps cleanly estradiol excluded; avoids E106L 2nd-shell pitfall
